{
  "tagName": "kst-auth-widget",
  "urls": {
    "development": "https://app-stage.keshet-tv.com/widgets/kst.auth.widget.js",
    "staging": "https://app-stage.keshet-tv.com/widgets/kst.auth.widget.js",
    "production": "https://app-stage.keshet-tv.com/widgets/kst.auth.widget.js"
  },
  "allowedProps": [
    "azure-app-id",
    "theme",
    "getToken"
  ],
  "forbiddenProps": [],
  "templateVersion": "1.0.0"
}
